id,conversation_id,created_at,date,time,timezone,user_id,username,name,place,tweet,mentions,urls,photos,replies_count,retweets_count,likes_count,location,hashtags,link,retweet,quote_url,video,profile_image_url,,,
1.07305933581772E+018,1.07275763607905E+018,1544672256000,2018-12-13,10:37:36,WIB,575220756,zulfikar_fiki,Zulfikar Ilham,,Sampai ingin bunuh diri,['muhiqbalbadafi'],[],[],1,0,0,,[],https://twitter.com/zulfikar_fiki/status/1073059335817719808,,,0,https://pbs.twimg.com/profile_images/1024314513548488705/OqQqzRY2.jpg,,,
1.07289633976626E+018,1.07289633976626E+018,1544633395000,2018-12-12,23:49:55,WIB,1.01921151419076E+018,98kiddos,HAWKEYEY,,*Aq ktika lelah dgn kehidupan ini dan ingin bunuh diri namun tetap dijalanNya*  https://twitter.com/AT_AbdillahToha/status/1072765585803612160 …,,['https://twitter.com/AT_AbdillahToha/status/1072765585803612160'],[],0,0,1,,[],https://twitter.com/98kiddos/status/1072896339766259712,,https://twitter.com/AT_AbdillahToha/status/1072765585803612160,0,https://pbs.twimg.com/profile_images/1121517780681908224/ecfdikri.jpg,,,
1.07283874539142E+018,1.0727733890754E+018,1544619663000,2018-12-12,20:01:03,WIB,2663778276,raanst_,Ajii,,"Astagaaaa, ingin bunuh diri rasanya.","['arielaaa94_', 'panggilsajaay', 'ayundaharun', 'wariman_']",[],[],1,0,0,,[],https://twitter.com/raanst_/status/1072838745391419392,,,0,https://pbs.twimg.com/profile_images/1120264246472765445/rSxHuLHz.jpg,,,
1.07282893712895E+018,1.07282596803568E+018,1544617325000,2018-12-12,19:22:05,WIB,1.00683564357237E+018,chagoround,Cha,,"""Banyak orang depresi, ingin bunuh diri dan kelakuan ga normal lainnya. Dan aku mau jadi orang yg bisa nolong mereka pa, ma""",['askmenfess'],[],[],0,0,2,,[],https://twitter.com/chagoround/status/1072828937128951808,,,0,https://pbs.twimg.com/profile_images/1107175856936386561/E02VBSGi.jpg,,,
1.07272685964364E+018,1.07272685964364E+018,1544592988000,2018-12-12,12:36:28,WIB,395766243,christinntl,Lia,,"MINGGU TUBESSSSSSS, LAPORAN 67 LEMBAR TULIS TANGAN BELOM , TUBES GAMTEK BELOMM, yeyeyelalalalalan ku ingin bunuh diri sajaaaaaa yeyeyeye oh kau plambing ~~~~",,[],[],1,0,1,,[],https://twitter.com/christinntl/status/1072726859643637760,,,0,https://pbs.twimg.com/profile_images/1120641931531264001/WBru_rPB.jpg,,,
1.07269461643086E+018,1.0726731053473E+018,1544585300000,2018-12-12,10:28:20,WIB,2407380116,basri721004,Basri Dj,,Analoginya sederhana..bgmn bisa seorang petahana ingin menang mutlak tp membenci islam apalgi mau mengkotak2kan islam itu namanya bunuh diri skaligus politisi bodoh...,"['abd_kodir', 'ustadtengkuzul']",[],[],1,0,0,,[],https://twitter.com/basri721004/status/1072694616430862337,,,0,https://pbs.twimg.com/profile_images/1099930591011590147/0uqe9MVq.jpg,,,
1.07268814326496E+018,1.0726326446834E+018,1544583757000,2018-12-12,10:02:37,WIB,1.06331229171673E+018,salmanhelmi4,Salman Helmi,,Mau potong leher aja nunggu pilpres.  Maksudnya mau bunuh diri bukan?  Rendah dan lemah sekali iman La nyala.  Hanya karena ingin di lirik kubu jokowi jadi berkata radikal. Itu konyol,"['ferdinand_haean', 'fadlizon']",[],[],0,0,0,,[],https://twitter.com/SalmanHelmi4/status/1072688143264956416,,,0,https://pbs.twimg.com/profile_images/1063315142903922688/GX6n4b8x.jpg,,,
1.07262475157365E+018,1.07262475157365E+018,1544568643000,2018-12-12,05:50:43,WIB,526645012,gepengsekali,Bisri Musthofa,,"""Menyambung silaturahim dapat memperpanjang umur dan datangkan keberkahan. Tapi kenapa kamu malah memutus tali silaturahim itu? Kamu ingin cepat mati tanpa harus bunuh diri?""   Mas Pur TOP, 2018.",,[],[],0,0,1,,[],https://twitter.com/gepengsekali/status/1072624751573647360,,,0,https://pbs.twimg.com/profile_images/872396273973841920/6uPq5g8i.jpg,,,
1.07256254160218E+018,1.07248348326257E+018,1544553811000,2018-12-12,01:43:31,WIB,243893129,udin_tok,udin( اُوْديْـن),,"kalau sengaja di cecerkan alangkah sembrononya petugas pemerintah saat ini, sama saja bunuh diri kecuali ada oknum yg tidak pro pemerintah sengaja ingin menjatuhkan kinerja pemerintah, dan terbukti isu ini terus di gulirkan dan efektif buat kubu oposisi",['gerindra'],[],[],0,0,0,,[],https://twitter.com/udin_tok/status/1072562541602181120,,,0,https://pbs.twimg.com/profile_images/2405610954/Gw_20gt.jpg,,,
1.07252716145684E+018,1.07252716145684E+018,1544545376000,2018-12-11,23:22:56,WIB,84749201,arifmeteor,rompi anti peluru,,Pernah ada Rasa cinta  Antara kita Kini tinggal kenangan Jauh kau pergi Meninggalkan diriku Disini aku  Merindukan dirimu  Ingin ku coba  Mencari pengganti mu Namun tak lagi  Kan seperti dirimu Okh Bintang ku   konon ceritanya yg bikin lagu ini mari bunuh diri,,[],[],0,0,0,,[],https://twitter.com/arifMeteor/status/1072527161456844807,,,0,https://pbs.twimg.com/profile_images/702150720661774336/7WMcu40B.jpg,,,
1.07237838545057E+018,1.07237838545057E+018,1544509905000,2018-12-11,13:31:45,WIB,1.06194670944452E+018,turtleyeh,#2019GantiPresiden,,Bagaimana caranya menghilang from this fkng world (gak bunuh diri). Aku hanya ingin menghilang.. sebentaaaaar saja #VideoMTV18del18 BTS @BTS_twt,['bts_twt'],[],[],0,0,0,,['#videomtv18del18'],https://twitter.com/turtleyeh/status/1072378385450569728,,,0,https://pbs.twimg.com/profile_images/1114098729751961601/1evRE4tc.jpg,,,
1.07236231490771E+018,1.07236231490771E+018,1544506074000,2018-12-11,12:27:54,WIB,63186636,elninogorontalo,Elnino Gorontalo,,"Kalau cuma ingin kaya, banyak orang kaya yg bunuh diri. Its all about happiness, buddies...  https://www.instagram.com/p/BrPDxtlHmid/?utm_source=ig_twitter_share&igshid=1hai54dda6oqn …",,['https://www.instagram.com/p/BrPDxtlHmid/?utm_source=ig_twitter_share&igshid=1hai54dda6oqn'],[],0,0,0,,[],https://twitter.com/elninogorontalo/status/1072362314907705344,,,0,https://pbs.twimg.com/profile_images/492635873461026819/szbrGh7m.jpeg,,,
1.07235941084291E+018,1.0723588334551E+018,1544505381000,2018-12-11,12:16:21,WIB,1.05138143166493E+018,meliness_id,Meliness Campaign,,"Kondisi jiwa ini dapat menyebabkan rusaknya hubungan pribadi, rendahnya motivasi dan produktivitas di tempat kerja, dan yang lebih buruk lagi dapat menyebabkan perasaan ingin melakukan bunuh diri.",,[],[],1,1,0,,[],https://twitter.com/Meliness_ID/status/1072359410842910720,,,0,https://pbs.twimg.com/profile_images/1051382094121717760/ZDvnsxOM.jpg,,,
1.07233636812526E+018,1.07233636554577E+018,1544499887000,2018-12-11,10:44:47,WIB,2840272358,rfqpp,🦄,,"Teman-teman LGBT memiliki resiko bunuh diri yang jauh lebih besar dibandingkan orang-orang heteroseksual. Tidak sedikit dari mereka yang depresi dan ingin mati karena perbedaan mereka. Lalu haruskah kita menambah beban mereka dengan menghina, menghakimi dan merendahkan mereka.",,[],[],1,0,0,,[],https://twitter.com/rfqpp/status/1072336368125263872,,,0,https://pbs.twimg.com/profile_images/1122106450778574848/9dWtbmsv.jpg,,,
1.07228437666099E+018,1.07228437666099E+018,1544487492000,2018-12-11,07:18:12,WIB,148694563,nakita_id,Nakita ID,,Billy Syahputra Sebut Kriss Hatta Ingin Bunuh Diri Saat Putus dari Hilda Vitria  http://nakita.grid.id/read/021261438/billy-syahputra-sebut-kriss-hatta-ingin-bunuh-diri-saat-putus-dari-hilda-vitria …,,['http://nakita.grid.id/read/021261438/billy-syahputra-sebut-kriss-hatta-ingin-bunuh-diri-saat-putus-dari-hilda-vitria'],[],0,0,0,,[],https://twitter.com/Nakita_ID/status/1072284376660987904,,,0,https://pbs.twimg.com/profile_images/937908929081704450/fNGWmS3X.jpg,,,
1.07207111396487E+018,1.07207111396487E+018,1544436646000,2018-12-10,17:10:46,WIB,1.07141668864874E+018,malikk______,Zaen,,Mengapa masih banyak orang bunuh diri padahal aku ingin hidup :'(,,[],[],0,0,0,,[],https://twitter.com/malikk______/status/1072071113964871680,,,0,https://pbs.twimg.com/profile_images/1071816799912521728/ZpF5edF5.jpg,,,
1.07206552454302E+018,1.07206552454302E+018,1544435313000,2018-12-10,16:48:33,WIB,1274102731,fahrunn_,f,,"Untuk apa kamu menyerah dan ingin bunuh diri?. Hei ingat, paling lama kekasihmu hanya akan merasa kehilangan dalam kurun waktu 3 minggu. Setelah itu jasadmu akan terganti dengan ia yang baru",,[],[],2,0,1,,[],https://twitter.com/fahrunn_/status/1072065524543016960,,,0,https://pbs.twimg.com/profile_images/1064788516880605184/misINTU4.jpg,,,
1.07203831900397E+018,1.07203831900397E+018,1544428827000,2018-12-10,15:00:27,WIB,8.27415222822384E+017,beelzebeub,Ezio,,Korsel punya cara unik untuk mengurangi kejadian bunuh diri. Pusat pengobatan di Seoul memiliki kelas untuk mereka yang ingin merasakan pengalaman mati. Peserta diminta menulis wasiat & masuk ke peti.  http://tirto.id/cD7C  (via Twitter  https://twitter.com/TirtoID/status/1071857014958022656 …) pic.twitter.com/EEejGhzmcE,,"['http://tirto.id/cD7C', 'https://twitter.com/TirtoID/status/1071857014958022656']",['https://pbs.twimg.com/media/DuClK8XWwAAeflC.jpg'],0,0,0,,[],https://twitter.com/Beelzebeub/status/1072038319003967488,,,0,https://pbs.twimg.com/profile_images/1105877920671719424/Kxq-3Dld.jpg,,,
1.07197500530142E+018,1.07197500530142E+018,1544413732000,2018-12-10,10:48:52,WIB,9.71962782093517E+017,whileyallhere,▫,,saya ingin bunuh diri,,[],[],0,0,0,,[],https://twitter.com/whileyallhere/status/1071975005301424128,,,0,https://pbs.twimg.com/profile_images/1087496986645983243/Ib4VFyET.jpg,,,
1.12757879295894E+018,1.12757878317358E+018,1557670708000,2019-05-12,21:18:28,WIB,192853381,pratamaputra362,Pratama A Putra,,"lalu manusia ditugaskan bunuh diri sebab itu adalah tugas moral setiap orang. seseorang bisa melakukannya dengan gembira, menaiki atas gedung lalu lompat dari atap dan pastikan menjatuhi bedebah sesamamu yg rakus. seperti itukah yg ingin kau dengar?",,[],[],1,0,0,,[],https://twitter.com/pratamaputra362/status/1127578792958939136,,,0,https://pbs.twimg.com/profile_images/378800000783141022/fc33d2dce72678ad69724e795e5a181f.jpeg,,,
1.12755954609895E+018,1.1275566935361E+018,1557666119000,2019-05-12,20:01:59,WIB,517178156,raeynzhi,Z H I A 🐼,,Kadang gue mikirin biaya tahun ini rasanya otak ingin meledak. Tapi berusaha dibawa santai. Dan tadi begitu dia nyalahin gue karena dianggap pelit.  Kalau gue ngga kuat iman. Rasanya udah mau bunuh diri ketika dihadapkan soal duit!,,[],[],1,0,1,,[],https://twitter.com/Raeynzhi/status/1127559546098950145,,,0,https://pbs.twimg.com/profile_images/1127518196720779266/_HU7v7_g.jpg,,,
1.12753400144122E+018,1.1275162306114E+018,1557660029000,2019-05-12,18:20:29,WIB,9.93384117063508E+017,lenoirsena,i’d wife me,,"Jadi sekarang, kalau gw ingin mati, gw selalu inget kalau ada seorang manusia sialan yang pernah bilang secara gamblang bahwa kalau gw sengaja bunuh diri, maka kematian gw akan menjadi suatu kesia-siaan yang mutlak. Dan emang bener, sih.",,[],[],1,0,0,,[],https://twitter.com/lenoirsena/status/1127534001441218560,,,0,https://pbs.twimg.com/profile_images/1121447616410075137/mJhe9DDO.jpg,,,
1.12751821430745E+018,1.12751817820296E+018,1557656265000,2019-05-12,17:17:45,WIB,186380938,bitterswee3t,🦊,,"4. Aku ingin jadi penulis - Sajama cut ""mari bunuh diri""  Tanpa Harapan.",,[],[],1,1,0,,[],https://twitter.com/bitterswee3t/status/1127518214307454976,,,0,https://pbs.twimg.com/profile_images/1127293032330481664/Em37E1J4.jpg,,,
1.12751761356993E+018,1.12751761356993E+018,1557656121000,2019-05-12,17:15:21,WIB,1.12598173347454E+018,sukagakjelass,Aku,,"sudah menyiapkan hati dari sekarang, jikalau doi akan di jodohkan nanti setelah lebaran :) kesel pasti, rasanya ingin menbunuh & bunuh diri.",,[],[],0,0,0,,[],https://twitter.com/sukagakjelass/status/1127517613569929216,,,0,https://pbs.twimg.com/profile_images/1126867559876153344/dcApDBB4.jpg,,,
1.12748286850505E+018,1.12747877764094E+018,1557647838000,2019-05-12,14:57:18,WIB,1.11778141474367E+018,deathofloud,Jiwon,,Rumitnya kehidupan membuatnya nyaris ingin bunuh diri. Walau ia sudah melakukan beberapa kali. Melukai dirinya menjadi hal yang paling biasa dilakukan sebelum tidur.      Setidaknya meringankan rasa stress yang ia rasakan.      Terkadang ia menangis sampai matanya sangat bengkak.,,[],[],1,0,0,,[],https://twitter.com/deathofloud/status/1127482868505047040,,,0,https://pbs.twimg.com/profile_images/1127494789723672581/2WUcs6Ww.jpg,,,
1.12735439337476E+018,1.12735439337476E+018,1557617207000,2019-05-12,06:26:47,WIB,2967566089,boiingee,Nani Istanti,,Mungkin hari ini ku menangis sampai ingin bunuh diri. Tapi hari esok siapa yang tau? Allah maha baik semua diperlihatkan dan diperjelas 😇🙏💪,,[],[],0,0,0,,[],https://twitter.com/boiingee/status/1127354393374760960,,,0,https://abs.twimg.com/sticky/default_profile_images/default_profile.png,,,
1.12733232822774E+018,1.12726436628427E+018,1557611946000,2019-05-12,04:59:06,WIB,523210072,_wahyupu,NIKILHO,,"Terlalu dalam mencintai ? Tai! 2thn yg lalu aku mati""an mengerjakan skripsi Dengan Ibu satu""nya motivasi. Ketika didlm ruang pendaftaran wisuda, Aku terima tlpn bahwa ibuku tiada.  Sakit mana ? Putus asa mana ?  Apakah aku ingin bunuh diri ? Tdk sma sekali. Lu nya aja yg GOBLOK!!",['ardddo'],[],[],1,0,0,,[],https://twitter.com/_WahyuPU/status/1127332328227737602,,,0,https://pbs.twimg.com/profile_images/946375340598861824/baw2fP7s.jpg,,,
1.1273219134438E+018,1.1273219134438E+018,1557609463000,2019-05-12,04:17:43,WIB,888585439,ardiansyahh27,KerangAjaib,,Ingin ku bunuh diri saja rasa nya diri ini,,[],[],0,0,0,,[],https://twitter.com/ardiansyahh27/status/1127321913443799040,,,0,https://pbs.twimg.com/profile_images/954987422932090881/nHxnkSHy.jpg,,,
1.12728523087894E+018,1.12728523087894E+018,1557600717000,2019-05-12,01:51:57,WIB,64161052,yuliiiii,MitaYulianaﻬ,,"""Aku tidak ingin membunuh kamu, tapi kamu ingin bunuh diri""",,[],[],0,0,0,,[],https://twitter.com/yuliiiii/status/1127285230878937088,,,0,https://pbs.twimg.com/profile_images/1127486113654775810/v91mx7cp.jpg,,,
1.12727522819787E+018,1.12727522819787E+018,1557598332000,2019-05-12,01:12:12,WIB,1.0304864973785E+018,bangkaikudanil,M Agus Rizal,,"Jika anda ingin mempercepat kematian, jngan bunuh diri. Cukup ngerjain tugas metpen saja.",,[],[],1,1,6,,[],https://twitter.com/bangkaikudanil/status/1127275228197867521,,,0,https://pbs.twimg.com/profile_images/1030503587082727425/65nr5_qN.jpg,,,
1.12726759302525E+018,1.12726436628427E+018,1557596512000,2019-05-12,00:41:52,WIB,154727397,ardddo,Ardo,,"Teman saya banyak, namun tidak ada yg mengerti. Sampai kapan harus seperti ini ? Terpuruk hingga terbesit ingin bunuh diri. Entahlah, akupun tidak mengerti. Aku terlalu dalam mencintai.",,[],[],2,0,0,,[],https://twitter.com/ardddo/status/1127267593025245184,,,0,https://pbs.twimg.com/profile_images/1125787311868768256/PMzEbhf5.jpg,,,
1.12724387665207E+018,1.12724387665207E+018,1557590858000,2019-05-11,23:07:38,WIB,530985907,dahpunyae,Mas Masan®,,"X: aku ingin menikahimu Y: emang kamu bisa apa? X: kan kubawa keluargaku ke surga Y: heeee, kamu mau ngajak bunuh diri? X: .....",,[],[],0,0,0,,[],https://twitter.com/dahpunyae/status/1127243876652072960,,,0,https://pbs.twimg.com/profile_images/687194658196209664/CbTg4SO0.jpg,,,
1.12724194529248E+018,1.12724194529248E+018,1557590397000,2019-05-11,22:59:57,WIB,1.11272886576642E+018,anduk_buluk,Hanya calon bangkai,,Jikalau setelah kematian itu tidak ada kehidupan lagi. Nescaya aku ingin bunuh diri saja. Daripada membebani banyak orang.,,[],[],0,0,0,,[],https://twitter.com/anduk_buluk/status/1127241945292480512,,,0,https://pbs.twimg.com/profile_images/1127051139462062081/OHGhytaf.jpg,,,
1.12722198605941E+018,1.12722198605941E+018,1557585638000,2019-05-11,21:40:38,WIB,97892327,aarafis,Adit,,"Diharuskan menyelesaikan bab 3 kurang dari 5 hari, rasa-rasa frustasi dan ingin bunuh diri.",,[],[],1,0,0,,[],https://twitter.com/aarafis/status/1127221986059407360,,,0,https://pbs.twimg.com/profile_images/1060138543316578304/KODFihWD.jpg,,,
1.12721305381506E+018,1.1267365776636E+018,1557583509000,2019-05-11,21:05:09,WIB,3232573765,misuchansu,依神紫苑、sʜɪᴏɴ.,,"ㅤ“... Menyenangkan? Kenapa? Kau ingin bunuh diri, yaaa?”",,[],[],0,0,0,,[],https://twitter.com/Misuchansu/status/1127213053815058432,,,0,https://pbs.twimg.com/profile_images/1127559508601950208/sLmroGhN.jpg,,,
1.12720696349269E+018,1.12720696349269E+018,1557582057000,2019-05-11,20:40:57,WIB,1.07140780840543E+018,muhammadharits_,i am a paradox,,Ingin aku bunuh diri dengan memanjat ke ego mu yang tinggi lalu loncat ke IQmu yang rendah.,,[],[],0,0,1,,[],https://twitter.com/muhammadharits_/status/1127206963492687873,,,0,https://pbs.twimg.com/profile_images/1127078198775242753/wWBYvGX1.jpg,,,
1.12717594574639E+018,1.12717594574639E+018,1557574662000,2019-05-11,18:37:42,WIB,1027648922,taroo_misaki,マッド,,"Ada salah satu sekian dari banyak orang ingin jadi penulis (saya) memberikan kutipan ; jangan sampai mencintai terlalu dalam, jika kau ingin keluar dari cinta yang dalam salah satu cara untuk keluar adalah dengan bunuh diri atau mati tenggelam.",,[],[],0,0,2,,[],https://twitter.com/taroo_misaki/status/1127175945746386944,,,0,https://pbs.twimg.com/profile_images/1127581174363148288/nLi55Hb2.jpg,,,
1.12711865954809E+018,1.12711865954809E+018,1557561003000,2019-05-11,14:50:03,WIB,238457985,dwibudaii,seruputkopii_,,"Selama 1 Bulan saya di pulau Sumbawa banyak temuan baru tentang anak-anak di sana. Mulai kasus bunuh diri, pendidikan, hingga kemiskinan. Semoga open donasi BUKU UNTUK DOMPU part 2 banyak yang ingin berpartisipasi. Terimakasih, Lemboade  pic.twitter.com/7B91KF0YQg",,[],['https://pbs.twimg.com/media/D6RUbbiV4AAU3wo.jpg'],0,1,0,,[],https://twitter.com/dwibudaii/status/1127118659548094464,,,0,https://pbs.twimg.com/profile_images/1125965015016542208/0rFNUz_4.jpg,,,
1.12711847837515E+018,1.12711847837515E+018,1557560960000,2019-05-11,14:49:20,WIB,1.00455974897972E+018,eropajokowi,berjuang untuk rakyat & umat,,Adakah rasa yg bikin pegal hati berkali-kali? Hingga ingin bunuh diri?  Yaitu kalah berkali-kali.eaaaa... @Arse00571581 @rianantony4 @peppychristian1 @LisaYusuf @christi01232264 @arimanik #KitaMenang #Jokowi2Periode,"['arse00571581', 'rianantony4', 'peppychristian1', 'lisayusuf', 'christi01232264', 'arimanik']",[],[],1,3,5,,"['#kitamenang', '#jokowi2periode']",https://twitter.com/EropaJokowi/status/1127118478375153664,,,0,https://pbs.twimg.com/profile_images/1125034045476237312/kouZnmZo.jpg,,,
1.12709226907978E+018,1.12709226907978E+018,1557554711000,2019-05-11,13:05:11,WIB,8.42014209109971E+017,andri000me_2,M Andri Gunawan Berita,,"Ingin Bunuh Diri, Seorang Penumpang Coba Buka Pintu Pesawat Delta  https://mandrigunawanberita.wordpress.com/2019/05/11/ingin-bunuh-diri-seorang-penumpang-coba-buka-pintu-pesawat-delta/ …",,['https://mandrigunawanberita.wordpress.com/2019/05/11/ingin-bunuh-diri-seorang-penumpang-coba-buka-pintu-pesawat-delta/'],[],0,0,0,,[],https://twitter.com/andri000me_2/status/1127092269079781376,,,0,https://pbs.twimg.com/profile_images/975018358482468864/9hQxCNDN.jpg,,,
1.12708934021809E+018,1.12708850284628E+018,1557554013000,2019-05-11,12:53:33,WIB,1.05332041326507E+018,udsrvbttr,Meh,,"This is interesting. Karena us udah kaya gini, selama yang ingin bunuh diri memang-memang pengen. Tapi keliatannya harus ada faktor lain juga. Kurang tau juga saya kalo gitu. Tapi dengan keadaan indo yang kaya gini keliatannya nggak deh.",['askmenfess'],[],[],1,0,2,,[],https://twitter.com/udsrvbttr/status/1127089340218085377,,,0,https://pbs.twimg.com/profile_images/1113442836668489728/smCbhTJO.jpg,,,
1.12708745483654E+018,1.12708745483654E+018,1557553564000,2019-05-11,12:46:04,WIB,231355136,sindonews,SINDOnews,,"Ingin Bunuh Diri, Seorang Penumpang Coba Buka Pintu Pesawat Delta  https://international.sindonews.com/read/1403335/42/ingin-bunuh-diri-seorang-penumpang-coba-buka-pintu-pesawat-delta-1557553072?utm_source=dlvr.it&utm_medium=referral …",,['https://international.sindonews.com/read/1403335/42/ingin-bunuh-diri-seorang-penumpang-coba-buka-pintu-pesawat-delta-1557553072?utm_source=dlvr.it&utm_medium=referral'],[],0,2,2,,[],https://twitter.com/SINDOnews/status/1127087454836539392,,,0,https://pbs.twimg.com/profile_images/1120208897711562752/jWW8x8ZB.png,,,
1.12703932915757E+018,1.12542367925959E+018,1557542090000,2019-05-11,09:34:50,WIB,1.12419651482432E+018,regitap69577615,Scorpion Girl,,"Seperti biasa, azan subuh berkumandang. Aku dan mama ku ingin pulang kerumah. Bambang yang mendengar azan mulai menunjukkan reaksi nya. Selesai di obati, Bambang malah semakin parah mengamuk nya. Dia sampai ingin ke dapur dan menggambil pisau untuk bunuh diri.",,[],[],1,0,0,,[],https://twitter.com/RegitaP69577615/status/1127039329157574656,,,0,https://pbs.twimg.com/profile_images/1125426568719785985/oyTh54iD.jpg,,,
1.1269517087335E+018,1.1269517087335E+018,1557521199000,2019-05-11,03:46:39,WIB,2191759916,diseduhh,manusiaseutuhnya,,Selamat pagi para pemilik hati yang tidak dikabari pacar sehari langsung ingin bunuh diri.,,[],[],0,0,1,,[],https://twitter.com/diseduhh/status/1126951708733497344,,,0,https://pbs.twimg.com/profile_images/1126564791076540416/qpMgEv7q.jpg,,,
1.12687749242849E+018,1.12687749242849E+018,1557503505000,2019-05-10,22:51:45,WIB,74101756,cakrabirawa2000,Sang~Kolonel™,,kaum tua hari ini menyelamatkan diri menawarkan diri untuk tiduri.. Kaum muda harus berani provokasi atas demokrasi yg telah dikebiri.. Jangan biarkan ibu Pertiwi meratapi nasibnya kini hingga ingin bunuh diri..  Saatnya menyulut api revolusi untuk negri gemah Ripah loh jinawi..,,[],[],0,2,3,,[],https://twitter.com/cakrabirawa2000/status/1126877492428492800,,,0,https://pbs.twimg.com/profile_images/699057909280305152/zm48td-F.jpg,,,
1.12686777068202E+018,1.12682165720345E+018,1557501187000,2019-05-10,22:13:07,WIB,211143743,farsyahiyyans,Ahmad Ainun Najib,,so far apa ada bantuan untuk yang ingin suicide? dalam artian bantuan untuk membuatnya mengurungkan niat ingin bunuh diri?,['sabitchair'],[],[],1,0,0,,[],https://twitter.com/FarsyahIyyans/status/1126867770682019842,,,0,https://pbs.twimg.com/profile_images/977555884942311424/OCcsZ1_D.jpg,,,
1.12681577964141E+018,1.12681577964141E+018,1557488791000,2019-05-10,18:46:31,WIB,495605872,ciagusb,ica,,"Ketika unek2 dikeluarkan satu per satu. Dan ada yg mendengarkan, ditampung dan diberi solusi.  Setidaknya tekanan ini tidak membuat orang ingin bunuh diri.",,[],[],1,0,1,,[],https://twitter.com/Ciagusb/status/1126815779641413634,,,0,https://pbs.twimg.com/profile_images/1124556896831135747/upEHWV9P.jpg,,,
1.12680949326889E+018,1.12675357816762E+018,1557487292000,2019-05-10,18:21:32,WIB,2951722813,subagio_amin,🤡JOKER🃏,,"Sesampainya di rumah, ia menemukan seluruh anggota keluarganya telah dibunuh. Untuk bertahan hidup, Mulan tidak punya pilihan lain selain menjadi seorang selir.  Tak ingin menjadi selir dan melacur, Mulan pun bunuh diri di rumahnya.",,[],[],1,0,0,,[],https://twitter.com/subagio_amin/status/1126809493268885505,,,0,https://pbs.twimg.com/profile_images/1119623734564769793/5FZ6GMAe.jpg,,,
1.1267815983916E+018,1.12663643569868E+018,1557480642000,2019-05-10,16:30:42,WIB,9.81739218777985E+017,rajaamirul13,BedilBola,,Sabar bang. Kami disini sedia membantu. Kami menjual alat untuk mereka yang ingin bunuh diri tanpa perlu ikat tali gantung kat kipas dan tanpa perlu jalan jauh² atas jambatan semata² ingin terjun jambatan. Alat ini cukup mudah digunakan. Manual disediakan. Yang berminat sila pm  pic.twitter.com/CxN3bqBwG6,['izharhafni'],[],['https://pbs.twimg.com/media/D6Mh48ZUUAIpwg5.jpg'],0,0,0,,[],https://twitter.com/RajaAmirul13/status/1126781598391603201,,,0,https://pbs.twimg.com/profile_images/1114252591045570560/WqRZU03h.jpg,,,
1.12677952294521E+018,1.12677952294521E+018,1557480147000,2019-05-10,16:22:27,WIB,1.09237225332332E+018,pandaakuu,less sugar daddy,,Aku ingin bunuh diri. Setiap saat. Aku membenci hidupku.  Tapi aku tak melakukannya. Karena aku begitu mencintai diriku sendiri.,,[],[],0,2,2,,[],https://twitter.com/pandaakuu/status/1126779522945208320,,,0,https://pbs.twimg.com/profile_images/1126901851545149440/Tk6zlKhU.jpg,,,
1.12667633067256E+018,1.12664656050101E+018,1557455544000,2019-05-10,09:32:24,WIB,7.28861390975328E+017,baroms0,Ben 5,,Hahaha ingin bunuh diri,['earthxchel'],[],[],1,0,0,,[],https://twitter.com/BAROMS0/status/1126676330672562178,,,0,https://pbs.twimg.com/profile_images/1126152895370448898/DKoGp0Y6.jpg,,,
1.12666897446318E+018,1.12432081160141E+018,1557453790000,2019-05-10,09:03:10,WIB,9.41161157682872E+017,wan0listhiwa,Bumantara,,"""aku ingin bunuh diri dengan cara terjun ke IQ mu yg rendah, dengan melompat dari ego mu yg tinggi..""","['heartless8377', 'taeklow']",[],[],0,0,0,,[],https://twitter.com/wan0listhiwa/status/1126668974463176705,,,0,https://pbs.twimg.com/profile_images/1111626953990291464/tgzjQhib.jpg,,,
1.12659582394334E+018,1.12659523847725E+018,1557436350000,2019-05-10,04:12:30,WIB,2164367917,temennyaboboboy,Gopal,,Aku ingin bunuh diri.,['tanyarlsub'],[],[],0,0,0,,[],https://twitter.com/temennyaboboboy/status/1126595823943340032,,,0,https://pbs.twimg.com/profile_images/1094625836064358400/2Z4xD8fS.jpg,,,
1.1265136434477E+018,1.12651269278768E+018,1557416756000,2019-05-09,22:45:56,WIB,1.09787962967358E+018,vanongenoemd,Sans Nom,,"Ketika saya mencari level materi dan mendapatkannya. Saya merasa kekosongan, kebingungan, keanehan dan terpikir ingin bunuh diri. Disaat itu saya mulai melihat dengan pandangan kompetitif layaknya permainan catur dan tertawa dengan drama kehidupan, hidup hanyalah guyonan belaka.",,[],[],1,0,0,,[],https://twitter.com/VanOngenoemd/status/1126513643447697409,,,0,https://pbs.twimg.com/profile_images/1108276835828158467/9yVKIW60.jpg,,,
